{
  "id": "wizard",
  "awAppId": "49354136",
  "name": "Wizard",
  "tagline": "Цифровые товары",
  "description": "Звезды и Premium для Telegram, пополнение игр, подписки, гифт-карты и eSIM для поездок.\n\nОплата в USDT прямо из кошелька.",
  "category": "shopping",
  "developer": {
    "name": "Wizard",
    "website": "https://wizard-bot.com",
    "support": "https://t.me/WizardSupp"
  },
  "icon": "icon.jpg",
  "screenshots": [
    "screenshots/1.png",
    "screenshots/2.png",
    "screenshots/3.png",
    "screenshots/4.png",
    "screenshots/5.png",
    "screenshots/6.png",
    "screenshots/7.png"
  ]
}
