{
  "id": "klyuet",
  "awAppId": "43757401",
  "name": "Клюёт!",
  "tagline": "Улов копится, даже когда игра закрыта",
  "description": "Зимняя рыбалка у лунки. Пингвин ловит сам, даже когда игра закрыта: заходите, забирайте улов из ведра и тратьте монеты на удочку, лунку, наживку, иглу и снаряжение. Пока игра открыта, у лунки клюёт по-настоящему, главное успеть подсечь.\n\nВ коллекции 32 вида рыб, от мойвы до Царь-рыбы. Соберите набор целиком и получите монеты. Каждую неделю одна рыба клюёт втрое чаще, а на доске трофеев видно, кто поймал самую тяжёлую рыбу каждого вида.\n\nТоп недели по весу улова и общий топ по очкам коллекции, подарки за вход несколько дней подряд. Ускорение улова можно включать бесплатно раз в несколько часов или купить через кошелёк. За уровни, первую золотую шпротину и всю коллекцию выдаются промокоды на скидку в «Мини-ап на заказ» и «Услугах для мини-апов».",
  "category": "games",
  "developer": {
    "name": "Летящий пингвин",
    "website": "https://studio.letipengvin.ru"
  },
  "icon": "icon.png",
  "screenshots": [
    "screenshots/1.png",
    "screenshots/2.png",
    "screenshots/3.png",
    "screenshots/4.png"
  ]
}
