{
  "id": "penguin-fly",
  "awAppId": "69616744",
  "name": "Пингвин, лети!",
  "tagline": "Аркада: лети, лови рыбу, бей рекорды",
  "description": "Пиксельная аркада про пингвина, который летит между ледяными колоннами. Одно касание, и он взмахивает крыльями. Задача простая: пролететь как можно дальше и не врезаться.\n\nПо пути ловите рыбок, а золотая даёт сразу десять. Рыбки копятся на шапки: двенадцать штук с отсылками к играм до 2010 года, шапку видно в полёте и в топе рядом с ником. Две особые шапки не купить, их можно только заслужить: кубок для тройки лучших недели и ледяную корону за 1000 очков.\n\nТоп недели и топ рекордов, подарки за вход несколько дней подряд. Каждый день есть бесплатные попытки, дополнительные попытки и шапки можно купить через кошелёк. За рекорды выдаются промокоды на скидку в «Мини-ап на заказ» и «Услугах для мини-апов». Каждый забег сервер проверяет сам, поэтому накрутить счёт нельзя.",
  "category": "games",
  "developer": {
    "name": "Летящий пингвин",
    "website": "https://studio.letipengvin.ru"
  },
  "icon": "icon.png",
  "screenshots": [
    "screenshots/1.png",
    "screenshots/2.png",
    "screenshots/3.png",
    "screenshots/4.png"
  ]
}
