{
  "id": "miniapp-studio",
  "awAppId": "59861525",
  "name": "Мини-ап на заказ",
  "tagline": "Мини-ап для вашего бизнеса под ключ",
  "description": "Студия «Летящий пингвин» делает мини-апы для Antarctic Wallet под ключ: промо-игру, платный доступ к контенту, мини-магазин, игру с покупками или проект по вашему брифу.\n\nЦена видна сразу: выберите решение и опции в калькуляторе, расчёт можно скопировать и переслать. Бриф заполняется в три шага, к нему можно приложить логотип и файлы. Дальше заказ идёт по этапам прямо в приложении: дизайн, разработка, тестовая версия, оплата и запуск.\n\nПредоплаты нет: платите через кошелёк перед запуском, когда утвердили тестовую версию. Два круга правок дизайна и круг правок тестовой версии входят в цену, ошибки исправляем бесплатно, после запуска две недели гарантии. Как это выглядит вживую, видно по нашим играм «Пингвин, лети!» и «Клюёт!».",
  "category": "business",
  "developer": {
    "name": "Летящий пингвин",
    "website": "https://studio.letipengvin.ru"
  },
  "icon": "icon.png",
  "screenshots": [
    "screenshots/1.png",
    "screenshots/2.png",
    "screenshots/3.png",
    "screenshots/4.png"
  ]
}
