{
  "id": "miniapp-services",
  "awAppId": "62302831",
  "name": "Услуги для мини-апов",
  "tagline": "Иконка, тексты, аудит и доработки",
  "description": "Небольшие услуги для тех, у кого мини-ап уже есть: иконка, обложка, тексты на русском и английском, аудит и часы доработки. У каждой услуги фиксированная цена и понятный срок.\n\nПоложите услуги в корзину и оплатите через кошелёк. После оплаты расскажите детали по каждой услуге, а результат придёт прямо в заказ: файлом, ссылкой или комментарием. Одна правка входит в цену.\n\nИконка, тексты и аудит вместе идут набором «Старт» со скидкой, а если горит, можно заказать срочно за доплату. Работают промокоды из игр «Пингвин, лети!» и «Клюёт!». Делает студия «Летящий пингвин».",
  "category": "business",
  "developer": {
    "name": "Летящий пингвин",
    "website": "https://studio.letipengvin.ru"
  },
  "icon": "icon.png",
  "screenshots": [
    "screenshots/1.png",
    "screenshots/2.png",
    "screenshots/3.png",
    "screenshots/4.png"
  ]
}
