{
  "id": "antarctic-example",
  "awAppId": "64596208",
  "name": "Antarctic Example",
  "tagline": "Пример embed-приложения",
  "description": "Пример приложения из example-embed-app",
  "category": "other",
  "developer": {
    "name": "Antarctic Wallet",
    "website": "https://antarcticwallet.com",
    "support": "https://t.me/Antarcticwalletsupport_bot"
  },
  "icon": "icon.jpg",
  "screenshots": [
    "screenshots/1.png",
    "screenshots/2.png",
    "screenshots/3.png",
    "screenshots/4.png"
  ]
}
